{
  "lifelog_id": "log_SYNTH_positive_short",
  "family_id": "family_SYNTH_000001",
  "seed_id": "seed_SYNTH_000001",
  "split": "train",
  "counterfactual_branch": "positive",
  "difficulty": "short",
  "referenced_source_seconds": 8.0,
  "event_count": 2,
  "events": [
    {
      "event_id": "evt_SYNTH_000001",
      "event_position": 0,
      "virtual_time": "D01 09:00",
      "source_time": null,
      "atom_id": null,
      "event_kind": "constructed_intention",
      "visible_text": "Please remind me to take the medicine next time I start cooking.",
      "source_srt_paths": null,
      "source_video_path": null,
      "video_mapping_status": "not_applicable",
      "rule_id": "rule_SYNTH_000001",
      "intention_state_before": null,
      "intention_state_after": "active_unreminded",
      "event_role": "intention_creation",
      "provenance": "constructed_intention"
    },
    {
      "event_id": "evt_SYNTH_000002",
      "event_position": 1,
      "virtual_time": "D01 09:30",
      "source_time": {
        "local_start_sec": 10.0,
        "local_end_sec": 18.0,
        "normalized_start_sec": 10.0,
        "normalized_end_sec": 18.0
      },
      "atom_id": "src_SYNTH_DAY1_000001",
      "event_kind": "source_video_atom",
      "visible_text": "A person starts preparing food in a kitchen.",
      "source_srt_paths": {
        "transcript": "synthetic/Transcript/SYNTH/DAY1/example.srt",
        "dense_caption": "synthetic/DenseCaption/SYNTH/DAY1/example.srt"
      },
      "source_video_path": null,
      "video_mapping_status": "pending",
      "rule_id": null,
      "intention_state_before": "active_unreminded",
      "intention_state_after": "active_unreminded",
      "event_role": "trigger",
      "provenance": "egolife_srt"
    }
  ]
}
